{"completeness":{"algorithm":"sha256","value":"0000000000000000000000000000000000000000000000000000000000000000"},"manifestFormatVersion":"0.3","provenance":{"connectorRevisionId":"0f9c1e2b3a4d5e6f7a8b9c0d1e2f3a4b","studio":{"estimatorVersion":3,"weights":{"sizeCost":1,"userPriority":6}}},"sections":{"agentSurface":{"inline":{"components":{"schemas":{"Error":{"properties":{"message":{"type":"string"}},"required":["message"],"type":"object"}}},"formatVersion":5,"operations":[{"annotations":{"idempotent":true,"openWorld":true,"readOnly":true},"binding":{"operation":"GET /pets","type":"http"},"inputSchema":{"properties":{"limit":{"maximum":100,"minimum":1,"type":"integer"}},"type":"object"},"name":"List pets","slug":"list-pets","summary":"Lists pets in the inventory"},{"annotations":{"destructive":true,"idempotent":true},"binding":{"operation":"DELETE /pets/{petId}","type":"http"},"name":"Delete pet","slug":"delete-pet"}]}},"operations":{"bytes":1234,"path":"sections/operations.json","sha256":"0000000000000000000000000000000000000000000000000000000000000000"},"policy":{"inline":{"allowedOrigins":["https://api.example.com"],"baseUrl":"https://api.example.com/v1","formatVersion":2,"limits":{"concurrency":8,"redirectHopLimit":5},"schemaBounds":{"maxDepth":32,"maxNodes":2048,"maxPropertiesPerLevel":256}}},"server":{"inline":{"formatVersion":2,"name":"Example API","surfaces":[{"isDefault":true,"navigator":{"enabled":true,"pageSize":25},"operations":[{"exposure":"direct","operation":"list-pets"},{"exposure":"navigator","operation":"delete-pet"}],"slug":"default"}]}}}}